{"evidence":[{"frame_id":"outer.root#0::exec::outer.exec_loop#1","kind":"loop.fixed_point_reached"}],"frames":[{"depth":0,"frame_id":"outer.root#0::exec::outer.exec_loop#0","mas_id":"outer.exec_loop","nodes":[{"annotations":{"virtual":"outer_in"},"id":"outer.root#0::exec::outer.exec_loop#0::__outer_in__","kind":"agent","ports":{"in":["plan"],"out":["plan"]}},{"annotations":{"virtual":"outer_out"},"id":"outer.root#0::exec::outer.exec_loop#0::__outer_out__","kind":"agent","ports":{"in":["report"],"out":["report"]}},{"capabilities":["exec.run"],"id":"outer.root#0::exec::outer.exec_loop#0::act","kind":"agent","ports":{"in":["plan"],"out":["evidence","next_plan"]}},{"capabilities":["evidence.read"],"id":"outer.root#0::exec::outer.exec_loop#0::verify","kind":"agent","ports":{"in":["evidence","next_plan"],"out":["pass","retry"]}}],"termination":null},{"depth":1,"frame_id":"outer.root#0::exec::outer.exec_loop#1","mas_id":"outer.exec_loop","nodes":[{"annotations":{"reason":"loop.fixed_point_reached"},"id":"outer.root#0::exec::outer.exec_loop#1::__cap__","kind":"fixed_point","ports":{"in":["plan"],"out":[]}},{"annotations":{"virtual":"outer_in"},"id":"outer.root#0::exec::outer.exec_loop#1::__outer_in__","kind":"agent","ports":{"in":["plan"],"out":["plan"]}},{"annotations":{"virtual":"outer_out"},"id":"outer.root#0::exec::outer.exec_loop#1::__outer_out__","kind":"agent","ports":{"in":["report"],"out":["report"]}}],"termination":{"node_id":"outer.root#0::exec::outer.exec_loop#1::__cap__","reason":"loop.fixed_point_reached"}},{"depth":0,"frame_id":"outer.root#0","mas_id":"outer.root","nodes":[{"annotations":{"virtual":"outer_in"},"id":"outer.root#0::__outer_in__","kind":"agent","ports":{"in":["request"],"out":["request"]}},{"annotations":{"virtual":"outer_out"},"id":"outer.root#0::__outer_out__","kind":"agent","ports":{"in":["receipt"],"out":["receipt"]}},{"capabilities":["voice.read"],"id":"outer.root#0::ingest","kind":"agent","ports":{"in":["request"],"out":["parsed"]}},{"capabilities":["plan.write"],"id":"outer.root#0::plan","kind":"agent","ports":{"in":["parsed"],"out":["plan"]}},{"capabilities":["evidence.write"],"id":"outer.root#0::publish","kind":"agent","ports":{"in":["report"],"out":["receipt"]}}],"termination":null}],"limits":{"fuel":8,"max_depth":3},"links":[{"capabilities":["voice.read"],"from":{"node":"outer.root#0::__outer_in__","port":"request"},"kind":"data","stitch":"outer_in","to":{"node":"outer.root#0::ingest","port":"request"}},{"capabilities":["exec.run"],"from":{"node":"outer.root#0::exec::outer.exec_loop#0::__outer_in__","port":"plan"},"kind":"data","stitch":"outer_in","to":{"node":"outer.root#0::exec::outer.exec_loop#0::act","port":"plan"}},{"capabilities":["evidence.write"],"from":{"node":"outer.root#0::exec::outer.exec_loop#0::__outer_out__","port":"report"},"kind":"data","stitch":"outer_out","to":{"node":"outer.root#0::publish","port":"report"}},{"capabilities":["evidence.read","exec.run"],"from":{"node":"outer.root#0::exec::outer.exec_loop#0::act","port":"evidence"},"kind":"data","stitch":"none","to":{"node":"outer.root#0::exec::outer.exec_loop#0::verify","port":"evidence"}},{"capabilities":["evidence.read","exec.run"],"from":{"node":"outer.root#0::exec::outer.exec_loop#0::act","port":"next_plan"},"kind":"data","stitch":"none","to":{"node":"outer.root#0::exec::outer.exec_loop#0::verify","port":"next_plan"}},{"capabilities":["evidence.read"],"from":{"node":"outer.root#0::exec::outer.exec_loop#0::verify","port":"pass"},"kind":"data","stitch":"outer_out","to":{"node":"outer.root#0::exec::outer.exec_loop#0::__outer_out__","port":"report"}},{"capabilities":["evidence.read"],"from":{"node":"outer.root#0::exec::outer.exec_loop#0::verify","port":"retry"},"guard":"retry","kind":"data","stitch":"self_recurse_in","to":{"node":"outer.root#0::exec::outer.exec_loop#1::__outer_in__","port":"plan"}},{"from":{"node":"outer.root#0::exec::outer.exec_loop#1::__outer_in__","port":"plan"},"kind":"control","stitch":"outer_in","to":{"node":"outer.root#0::exec::outer.exec_loop#1::__cap__","port":"plan"}},{"from":{"node":"outer.root#0::exec::outer.exec_loop#1::__outer_out__","port":"report"},"kind":"data","stitch":"outer_out","to":{"node":"outer.root#0::exec::outer.exec_loop#0::__outer_out__","port":"report"}},{"capabilities":["plan.write","voice.read"],"from":{"node":"outer.root#0::ingest","port":"parsed"},"kind":"data","stitch":"none","to":{"node":"outer.root#0::plan","port":"parsed"}},{"capabilities":["plan.write"],"from":{"node":"outer.root#0::plan","port":"plan"},"kind":"data","stitch":"outer_in","to":{"node":"outer.root#0::exec::outer.exec_loop#0::__outer_in__","port":"plan"}},{"capabilities":["evidence.write"],"from":{"node":"outer.root#0::publish","port":"receipt"},"kind":"data","stitch":"outer_out","to":{"node":"outer.root#0::__outer_out__","port":"receipt"}}],"schema_version":"recursive-mas-unrolled/v0.1","source_digest":"sha256:5686be7d4602df5e5f62e66e7073b43cdc0bbde446a4bedadebe70d1316ddcd2"}